{"schemaVersion":"1.0.0","id":"pa-2026-regular-111","citation":"P.A. 26-111","extractorVersion":1,"source":{"url":"https://www.cga.ct.gov/2026/act/pa/pdf/2026PA-00111-R00SB-00282-PA.pdf","bytes":103723,"sha256":"1321fd1449c3b75b4ec897ae26d1187408a8bf5ea844b8bc981fc5840a35eba4","pages":4,"lastModified":"Thu, 04 Jun 2026 18:39:51 GMT"},"front":{"bill":"Substitute Senate Bill No. 282","act":"Public Act No. 26-111","title":"AN ACT APPROPRIATING FUNDS TO THE NEGLECTED CEMETERY ACCOUNT, CONCERNING CARE AND MAINTENANCE OF WARTIME VETERANS' GRAVES AND ESTABLISHING A PROCESS FOR THE NOTIFICATION OF MUNICIPALITIES REGARDING SUCH GRAVES."},"approved":"Approved June 4, 2026","sections":[{"number":"1","anchor":"sec-1","effective":"Effective July 1, 2026"},{"number":"2","anchor":"sec-2","effective":"Effective July 1, 2026"},{"number":"3","anchor":"sec-3","effective":"Effective July 1, 2026"},{"number":"4","anchor":"sec-4","effective":"Effective July 1, 2026"}],"blocks":[
{"type":"p","page":1,"runs":["Be it enacted by the Senate and House of Representatives in General Assembly convened:"]},
{"type":"p","page":1,"runs":["Section 1. Section 27-123 of the general statutes is repealed and the following is substituted in lieu thereof (Effective July 1, 2026):"],"anchor":"sec-1","section":"1"},
{"type":"p","page":1,"runs":["[In each city and town there shall be appointed annually, by the] ",{"ins":"(a) The"}," chief executive authority of [the] ",{"ins":"each"}," city or town [,] ",{"ins":"shall annually appoint"}," a committee of three citizens of the city or town, who are veterans and whose duty it shall be to see that the grave of any person who served in time of war in the military or naval forces of the English colonies in America, prior to 1776, or of the state of Connecticut or in the armed forces of the United States, [shall be suitably kept and] ",{"ins":"is suitably"}," cared for ",{"ins":"and maintained"},"."],"section":"1"},
{"type":"p","page":1,"runs":[{"ins":"(b)"}," If the cost of [such care and maintenance] ",{"ins":"suitably caring for and maintaining any grave described in subsection (a) of this section"}," is not paid by private persons or by the trustees of the cemetery where any such grave is situated, [it] ",{"ins":"such cost"}," shall be paid by the city or town; and cities and towns are authorized to appropriate money",{"ins":", and to apply for money available under section 19a-308b,"}," for such purpose. Money so appropriated",{"ins":", or received under section 19a-308b,"}," may be expended directly by the city or town or may be paid to the trustees or manager of the cemetery in which any such grave is [located] ",{"ins":"situated"},"; but the sum paid in any year shall not exceed for any such grave the sum usually charged for the annual care and maintenance of a grave in the same cemetery or, if no such charge is made in that cemetery, it shall not exceed the sum charged in other cemeteries in the same city or town for such service, provided, when any such grave has settled appreciably, such sum may be exceeded."],"section":"1"},
{"type":"p","page":2,"runs":["Sec. 2. Section 19a-308 of the general statutes is repealed and the following is substituted in lieu thereof (Effective July 1, 2026):"],"anchor":"sec-2","section":"2"},
{"type":"p","page":2,"runs":["(a) In any town in which there is a burial ground or cemetery containing more than six places of interment that has been neglected and allowed to grow up to weeds, briars and bushes, or about which the fences have become broken, decayed or dilapidated, the selectmen of such town may cause such burial ground or cemetery to be cleared of weeds, briars and bushes, may mow the ground's lawn areas",{"ins":","}," [and] may cause its fences or walls to be repaired and kept in orderly and decent condition and its memorial stones to be straightened, repaired and restored ",{"ins":"and may otherwise suitably care for and maintain any grave described in subsection (a) of section 27-123, as amended by this act"},"."],"section":"2"},
{"type":"p","page":2,"runs":["(b) No municipality or employee, officer or agent of a municipality shall be civilly or criminally liable for undertaking the care and maintenance of a burial ground or cemetery, as described in subsection (a) of this section."],"section":"2"},
{"type":"p","page":2,"runs":["Sec. 3. (Effective July 1, 2026) The sum of one hundred thousand dollars shall be transferred from the resources of the General Fund to the neglected cemetery account established pursuant to section 19a-308b of the general statutes and credited to such account for the fiscal year ending June 30, 2027. Such funds may be used to make grants to eligible municipalities for municipal maintenance of neglected burial grounds and cemeteries, as described in section 19a-308 of the general statutes, as amended by this act."],"anchor":"sec-3","section":"3"},
{"type":"p","page":3,"runs":["Sec. 4. (NEW) (Effective July 1, 2026) (a) The Commissioner of Veterans Affairs shall make available on the Internet web site of the Department of Veterans Affairs a form through which any individual may submit information to the department concerning any grave described in subsection (a) of section 27-123 of the general statutes, as amended by this act, that has not been suitably cared for and maintained as required under said section. Such form shall require that the individual include with such submission (1) the name of the burial ground or cemetery within which such grave is situated, (2) the city or town containing such burial ground or cemetery, (3) the name of the person interred in such grave, and (4) any other information the commissioner deems necessary to implement the provisions of this section."],"anchor":"sec-4","section":"4"},
{"type":"p","page":3,"runs":["(b) Not later than seven days after receipt of any submission described in subsection (a) of this section, the commissioner shall notify the chief executive authority of the city or town containing the burial ground or cemetery within which the grave is situated to (1) advise of such grave and provide the information included in such submission, (2) advise of the requirements of section 27-123 of the general statutes, as amended by this act, (3) direct that the committee appointed pursuant to subsection (a) of said section (A) be apprised of such grave and information, and (B) with respect to such grave and information, take any actions necessary for such city or town to comply with such requirements, and (4) advise of any moneys available, including, but not limited to, moneys available under section 19a-308b of the general statutes, that may be used to assist with such compliance."],"section":"4"},
{"type":"action","page":4,"runs":["Governor's Action:"]},
{"type":"action","page":4,"runs":["Approved June 4, 2026"]}
]}
