{"schemaVersion":"1.0.0","id":"pa-2026-regular-60","citation":"P.A. 26-60","extractorVersion":1,"source":{"url":"https://www.cga.ct.gov/2026/act/pa/pdf/2026PA-00060-R00HB-05332-PA.pdf","bytes":104057,"sha256":"b3a05e05af92621092e03665b4c72c708b7be410c0e5c22524a2e86f060b9d31","pages":4,"lastModified":"Wed, 27 May 2026 11:54:44 GMT"},"front":{"bill":"Substitute House Bill No. 5332","act":"Public Act No. 26-60","title":"AN ACT CONCERNING CERTAIN BOATING REGULATIONS."},"approved":"Approved May 20, 2026","sections":[{"number":"1","anchor":"sec-1","effective":"Effective from passage"},{"number":"2","anchor":"sec-2","effective":"Effective from passage"},{"number":"3","anchor":"sec-3","effective":"Effective from passage"},{"number":"4","anchor":"sec-4","effective":"Effective from passage"},{"number":"5","anchor":"sec-5","effective":"Effective from passage"},{"number":"6","anchor":"sec-6","effective":"Effective from passage"},{"number":"7","anchor":"sec-7","effective":"Effective from passage"}],"blocks":[
{"type":"p","page":1,"runs":["Be it enacted by the Senate and House of Representatives in General Assembly convened:"]},
{"type":"p","page":1,"runs":["Section 1. Section 15-133 of the 2026 supplement to the general statutes is amended by adding subsection (m) as follows (Effective from passage):"],"anchor":"sec-1","section":"1"},
{"type":"p","page":1,"runs":["(NEW) (m) No operator shall allow any person aboard a recreational motorboat under power to sit on the gunwale with one or both legs over the outside of the gunwale, or to stand on the gunwale while such vessel is underway at greater than slow-no-wake speed."],"section":"1"},
{"type":"p","page":1,"runs":["Sec. 2. Subsection (b) of section 15-140j of the general statutes is repealed and the following is substituted in lieu thereof (Effective from passage):"],"anchor":"sec-2","section":"2"},
{"type":"p","page":1,"runs":["(b) No person shall operate a personal watercraft or a JAV unless such person has been issued a certificate of personal watercraft operation by the Commissioner of Energy and Environmental Protection. No person less than sixteen years of age shall operate a JAV. No owner of a personal watercraft or a JAV shall knowingly authorize or permit a person who [is less than sixteen years of age who] does not have a certificate of personal watercraft operation issued by the commissioner to operate such personal watercraft or JAV on the waters of the state. Notwithstanding the provisions of this section, the commissioner may modify or suspend, by written permission, any age or certification requirement set forth in this section for the purpose of a marine event held pursuant to section 15-140b. In those waters where the United States Coast Guard has jurisdiction over marine events, such permit shall not be valid unless and until the commissioner receives a copy of the United States Coast Guard authorization for a marine event."],"section":"2"},
{"type":"p","page":2,"runs":["Sec. 3. (NEW) (Effective from passage) No owner shall allow a vessel to be placed on the waters of the state unless current and valid contact information for the owner of such vessel is legibly printed on such vessel or attached to such vessel, as prescribed by the Department of Energy and Environmental Protection, except any vessel for which the owner holds a valid and effective certificate of number awarded by the state, another state or the federal government."],"anchor":"sec-3","section":"3"},
{"type":"p","page":2,"runs":["Sec. 4. Section 15-136b of the 2026 supplement to the general statutes is repealed and the following is substituted in lieu thereof (Effective from passage):"],"anchor":"sec-4","section":"4"},
{"type":"p","page":2,"runs":["[Notwithstanding any provision of the general statutes, the period of time for operation of motorboats on Wyassup Lake, in the town of North Stonington, shall be from the Saturday prior to Memorial Day to September fifteenth.] ",{"ins":"(a) For the period commencing on the Saturday prior to Memorial Day to the fifteenth day of September of each year, between the hours of eleven o'clock in the morning and six o'clock in the evening, motorboats may be operated on Wyassup Lake, in the town of North Stonington, at speeds in excess of eight miles per hour and persons may waterski or operate a vessel towing a water skier."}],"section":"4"},
{"type":"p","page":2,"runs":[{"ins":"(b) Notwithstanding the provisions of subsection (a) of this section, no person shall waterski or operate a vessel towing a water skier between the islands and the east shore of Wyassup Lake in the town of North Stonington."}],"section":"4"},
{"type":"p","page":3,"runs":["Sec. 5. Subsection (d) of section 15-140c of the general statutes is repealed and the following is substituted in lieu thereof (Effective from passage):"],"anchor":"sec-5","section":"5"},
{"type":"p","page":3,"runs":["(d) Any party with standing may seek full cost recovery from the person who abandoned the vessel for any unpaid expense ",{"ins":"or cost"}," incurred as a result of, or incidental to, such vessel abandonment. ",{"ins":"Any party with standing that is a state or municipal law enforcement agency may additionally recover any associated environmental remediation costs or expenses and any expense or cost associated with, or incidental to, the removal of such vessel, including, but not limited to, any legal or court cost or expense incurred in the recovery and removal of such abandoned vessel."}," Any person who acts in good faith and without malicious intent in the processing, storage or movement of any abandoned vessel pursuant to this section shall be immune from civil liability for damage to such vessel."],"section":"5"},
{"type":"p","page":3,"runs":["Sec. 6. Subdivision (1) of subsection (h) of section 15-140c of the general statutes is repealed and the following is substituted in lieu thereof (Effective from passage):"],"anchor":"sec-6","section":"6"},
{"type":"p","page":3,"runs":["(1) ",{"ins":"(A)"}," The party with standing shall file a notarized notice of abandoned vessel with the Commissioner of Energy and Environmental Protection in person, by mail, by paid delivery service or electronically, as prescribed by the commissioner. Such filing shall be on forms as prescribed by the commissioner. The fee for filing such notice shall be twenty dollars."],"section":"6"},
{"type":"p","page":3,"runs":[{"ins":"(B) Notwithstanding the provisions of subparagraph (A) of this subdivision, any such notarization and filing fee shall not be required of any party with standing that is the state, a municipality or a law enforcement agency of the state or any such municipality."}],"section":"6"},
{"type":"p","page":4,"runs":["Sec. 7. Subsection (m) of section 15-140c of the general statutes is repealed and the following is substituted in lieu thereof (Effective from passage):"],"anchor":"sec-7","section":"7"},
{"type":"p","page":4,"runs":["(m) Any person who abandons a vessel shall have committed a violation and shall be fined not less than [three hundred] ",{"ins":"seven hundred fifty"}," dollars nor more than [five hundred] ",{"ins":"one thousand"}," dollars, except if such abandonment occurred during a declared emergency and as a result of the conditions that caused such emergency to be declared."],"section":"7"},
{"type":"action","page":4,"runs":["Governor's Action:"]},
{"type":"action","page":4,"runs":["Approved May 20, 2026"]}
]}
