{"schemaVersion":"1.0.0","id":"pa-2026-regular-125","citation":"P.A. 26-125","extractorVersion":1,"source":{"url":"https://www.cga.ct.gov/2026/act/pa/pdf/2026PA-00125-R00HB-05259-PA.pdf","bytes":92257,"sha256":"7a4991878983098cc86101362cc4b195269388e5276fc9d4baeea09eb0f8cce0","pages":2,"lastModified":"Thu, 04 Jun 2026 18:44:17 GMT"},"front":{"bill":"House Bill No. 5259","act":"Public Act No. 26-125","title":"AN ACT CONCERNING THE EDUCATION OF HOMELESS CHILDREN AND YOUTH."},"approved":"Approved June 4, 2026","sections":[{"number":"1","anchor":"sec-1","effective":"Effective October 1, 2026"}],"blocks":[
{"type":"p","page":1,"runs":["Be it enacted by the Senate and House of Representatives in General Assembly convened:"]},
{"type":"p","page":1,"runs":["Section 1. Subsection (f) of section 10-253 of the general statutes is repealed and the following is substituted in lieu thereof (Effective October 1, 2026):"],"anchor":"sec-1","section":"1"},
{"type":"p","page":1,"runs":["(f) Notwithstanding any provision of the general statutes, educational services shall be provided by each local and regional board of education to homeless children and youths in accordance with the provisions of 42 USC 11431, et seq., [as amended from time to time] ",{"ins":"revised to December 23, 2022"},". If a homeless child or youth is denied school accommodations by a local or regional board of education on the basis of residency, such homeless child or youth shall be entitled to a hearing conducted pursuant to section 10-186. An unaccompanied youth, as described in 42 USC 11434a, as amended from time to time, shall be entitled to knowledge of and have access to all educational, medical or similar records in the cumulative record of such unaccompanied youth maintained by a local or regional board of education."],"section":"1"},
{"type":"action","page":2,"runs":["Governor's Action:"]},
{"type":"action","page":2,"runs":["Approved June 4, 2026"]}
]}
