{"schemaVersion":"1.0.0","id":"pa-2026-regular-123","citation":"P.A. 26-123","extractorVersion":1,"source":{"url":"https://www.cga.ct.gov/2026/act/pa/pdf/2026PA-00123-R00HB-05145-PA.pdf","bytes":83153,"sha256":"f7aef2ce814d0f503874b9b3e3c0097f71aa8df0d26ac3d59f7066b4fe526872","pages":2,"lastModified":"Tue, 02 Jun 2026 19:42:56 GMT"},"front":{"bill":"Substitute House Bill No. 5145","act":"Public Act No. 26-123","title":"AN ACT REQUIRING THE PUBLIC UTILITIES REGULATORY COMMISSION TO REPORT ON THE REVIEW PROCESS FOR CERTAIN WATER COMPANIES THAT REQUEST TO CEASE OPERATIONS."},"approved":"Approved June 2, 2026","sections":[{"number":"1","anchor":"sec-1","effective":"Effective from passage"},{"number":"2","anchor":"sec-2","effective":"Effective from passage"}],"blocks":[
{"type":"p","page":1,"runs":["Be it enacted by the Senate and House of Representatives in General Assembly convened:"]},
{"type":"p","page":1,"runs":["Section 1. (Effective from passage) Not later than January 15, 2027, the Public Utilities Regulatory Authority, in consultation with the Department of Public Health, shall submit a report, in accordance with the provisions of section 11-4a of the general statutes, to the joint standing committees of the General Assembly having cognizance of matters relating to commerce, public health and energy. Such report shall include a listing of each instance, in the most recent two calendar years, in which a water company, as defined in section 16-262n of the general statutes, submitted an application for consent of the authority or department to cease its operations or discontinue the provision of water service to customers pursuant to the provisions of section 16-46 of the general statutes, as amended by this act. Such report shall include (1) a docket timeline for each such application that specifies the dates of any docket activity, (2) a list of any documents or other materials upon which the authority relied in rendering a decision on such application, including, but not limited to, responses to interrogatories, water quality reports and written testimony, and (3) any other details concerning the processing of such application that the authority deems appropriate to include in such report."],"anchor":"sec-1","section":"1"},
{"type":"p","page":2,"runs":["Sec. 2. Section 16-46 of the general statutes is amended by adding subsection (c) as follows (Effective from passage):"],"anchor":"sec-2","section":"2"},
{"type":"p","page":2,"runs":["(NEW) (c) Not later than July 1, 2026, the Public Utilities Regulatory Authority shall initiate a docket for the purpose of adopting regulations, in accordance with the provisions of chapter 54, requiring that, in any notice of a proceeding conducted pursuant to this section that is issued by the authority, the authority shall provide written instructions that inform a water company of the process whereby such company may request an expedited review of a request made pursuant to this section."],"section":"2"},
{"type":"action","page":2,"runs":["Governor's Action:"]},
{"type":"action","page":2,"runs":["Approved June 2, 2026"]}
]}
