{"schemaVersion":"1.0.0","id":"pa-2026-regular-18","citation":"P.A. 26-18","extractorVersion":1,"source":{"url":"https://www.cga.ct.gov/2026/act/pa/pdf/2026PA-00018-R00SB-00427-PA.pdf","bytes":98844,"sha256":"536fa4e8157c65632560d804e9aa226db75bc8122f2bc736a84fbe76bc1f83cd","pages":3,"lastModified":"Wed, 27 May 2026 11:47:22 GMT"},"front":{"bill":"Substitute Senate Bill No. 427","act":"Public Act No. 26-18","title":"AN ACT CONCERNING DUAL ENROLLMENT PROGRAMS."},"approved":"Approved May 20, 2026","sections":[{"number":"1","anchor":"sec-1","effective":"Effective July 1, 2026"}],"blocks":[
{"type":"p","page":1,"runs":["Be it enacted by the Senate and House of Representatives in General Assembly convened:"]},
{"type":"p","page":1,"runs":["Section 1. Section 10-221w of the 2026 supplement to the general statutes is repealed and the following is substituted in lieu thereof (Effective July 1, 2026):"],"anchor":"sec-1","section":"1"},
{"type":"p","page":1,"runs":["(a) As used in this section:"],"section":"1"},
{"type":"p","page":1,"runs":["(1) \"Advanced course or program\" means an honors class, advanced placement class, International Baccalaureate program, Cambridge International program, dual enrollment, dual credit, early college or any other advanced or accelerated course or program offered by a local or regional board of education in grades nine to twelve, inclusive; [and]"],"section":"1"},
{"type":"p","page":1,"runs":["(2) \"Prior academic performance\" means the course or courses that a student has taken, the grades received for such course or courses and a student's grade point average",{"ins":"; and"}],"section":"1"},
{"type":"p","page":1,"runs":[{"ins":"(3) \"Dual enrollment course\" and \"concurrent enrollment course\" have the same meanings as provided in section 10a-35d"},"."],"section":"1"},
{"type":"p","page":1,"runs":["(b) Not later than July 1, 2022, each local and regional board of education shall adopt a policy, or revise an existing policy, concerning the eligibility criteria for student enrollment in an advanced course or program. Such policy shall provide for multiple methods by which a student may satisfy the eligibility criteria for enrollment in an advanced course or program, including, but not limited to, recommendations from teachers, administrators, school counselors or other school personnel. Such eligibility criteria shall not be based exclusively on a student's prior academic performance and any use of a student's prior academic performance shall rely on evidence-based indicators of how a student will perform in an advanced course or program."],"section":"1"},
{"type":"p","page":2,"runs":["(c) Any policy adopted or revised and implemented under this section shall be in accordance with guidance provided by the Department of Education."],"section":"1"},
{"type":"p","page":2,"runs":["(d) ",{"ins":"(1)"}," Not later than July 1, 2026, the Commissioner of Education shall, in partnership with the constituent units of the state system of higher education and independent institutions of higher education, as defined in section 10a-173, develop a model agreement between secondary schools and postsecondary institutions for the provision of dual enrollment courses and concurrent enrollment courses, as such terms are defined in section 10a-35d, and postsecondary credit courses to students in grades nine to twelve, inclusive."],"section":"1"},
{"type":"p","page":2,"runs":[{"ins":"(2) Not later than January 1, 2027, the Commissioner of Education shall appoint a dual and concurrent enrollment course coordinator to track the establishment of such courses throughout the state and student outcomes from such courses, including, but not limited to, completion rates and average grades, by school district."}],"section":"1"},
{"type":"p","page":2,"runs":["(e) For the fiscal year ending June 30, 2027, and each fiscal year thereafter, the Commissioner of Education shall, within available appropriations, establish a fee-waiver grant program to expand opportunities for high-need high school students to access advanced courses or programs",{"ins":", including, but not limited to, dual and concurrent enrollment courses"},". A local or regional board of education ",{"ins":"or institution of higher education in the state"}," may apply, in a form and manner prescribed by the Commissioner of Education, for reimbursement for any fees charged to such board ",{"ins":"or incurred by such institution"}," for any high-need student who enrolls in an advanced course or program. ",{"ins":"No institution of higher education that receives a grant pursuant to this subsection shall charge the parents of a student for the cost of enrolling in the advanced course or program for which such institution received the grant."}],"section":"1"},
{"type":"p","page":3,"runs":["(f) For the fiscal year ending June 30, 2027, and each fiscal year thereafter, the Commissioner of Education may, within available appropriations, pay up to five hundred thousand dollars in a fiscal year to the State Education Resource Center for programming that provides direct support to local and regional boards of education in the articulation and expansion of dual credit courses. In expending such funds under this subsection, the State Education Resource Center shall give priority to providing funds to alliance districts."],"section":"1"},
{"type":"action","page":3,"runs":["Governor's Action:"]},
{"type":"action","page":3,"runs":["Approved May 20, 2026"]}
]}
