{"schemaVersion":"1.0.0","id":"pa-2026-regular-143","citation":"P.A. 26-143","extractorVersion":1,"source":{"url":"https://www.cga.ct.gov/2026/act/pa/pdf/2026PA-00143-R00HB-05354-PA.pdf","bytes":89399,"sha256":"e2a6638afdabd5ba73e0d43b46789ef95369d5cd4b0c540a61ceac2bb137b730","pages":1,"lastModified":"Tue, 02 Jun 2026 19:43:43 GMT"},"front":{"bill":"Substitute House Bill No. 5354","act":"Public Act No. 26-143","title":"AN ACT CONCERNING MEDICAID PROVIDER AUDITS."},"approved":"Approved June 2, 2026","sections":[{"number":"1","anchor":"sec-1","effective":"Effective October 1, 2026"}],"blocks":[
{"type":"p","page":1,"runs":["Be it enacted by the Senate and House of Representatives in General Assembly convened:"]},
{"type":"p","page":1,"runs":["Section 1. Subdivision (4) of subsection (d) of section 17b-99 of the general statutes is repealed and the following is substituted in lieu thereof (Effective October 1, 2026):"],"anchor":"sec-1","section":"1"},
{"type":"p","page":1,"runs":["(4) A finding of overpayment or underpayment to a provider in a program operated or administered by the department pursuant to this chapter or chapter 319t, 319v, 319y or 319ff, except a provider for which rates are established pursuant to section 17b-340, shall not be based on extrapolation unless the total net amount of extrapolated overpayment calculated from a statistically valid sampling and extrapolation methodology exceeds [one] ",{"ins":"two"}," and three-quarters per cent of total claims paid to the provider for the audit period. ",{"ins":"Beginning with audit review periods commencing January 1, 2027, the commissioner shall make available up-to-date education materials and technical assistance documents to assist providers with proper Medicaid billing prior to extrapolation."}],"section":"1"},
{"type":"action","page":1,"runs":["Governor's Action:"]},
{"type":"action","page":1,"runs":["Approved June 2, 2026"]}
]}
